{
  "schema_version": "1.0.0",
  "result_id": "nmlt-benchmark-result-v1:sha256:ff00c850c6a04cfcc1e6bca12ce06db5e50fad35f18a2eed28edd2becf3aec71",
  "case_id": "blind-replay",
  "source": {
    "path": "benchmarks/seeded-defects/provider-attempt/blind-replay.nmlt",
    "source_id": "nmlt-source-v1:sha256:1d61387c8998f8e2bda759a2ba05d66201507e522bbedf5bc4483b3ed4afaaac"
  },
  "engine": {
    "name": "nmlt-explicit-state",
    "version": "0.0.1",
    "source_set_id": "nmlt-engine-source-set-v1:sha256:a3eabe3f83605e96138eac6e760c086b0d219a1d9e75c7055d8fc9d43a199d5a",
    "executable_sha256": "6a6976a5c3ba67d0520594f36344748e8663db8497c57f93d8209a98e095b2b4",
    "toolchain": "rustc 1.94.0 (4a4ef493e 2026-03-02)",
    "target": "x86_64-unknown-linux-gnu",
    "algorithm": "deterministic-bfs-v1",
    "report_schema": "model-check-report/1.0.0"
  },
  "configuration": {
    "max_states": 10000,
    "max_depth": 100,
    "action_order": "lexicographic-action-then-state",
    "terminal_behavior": "identity-stutter"
  },
  "assumptions": [
    "The executable provider fragment and i64 arithmetic match the frozen source intent.",
    "A model_checked result requires exhaustion of the reachable frontier within both bounds."
  ],
  "trusted_components": [
    "nmlt-core lossless lexer",
    "nmlt-engine parser, contextual elaborator, type checker, evaluator, and BFS explorer",
    "Rust standard library ordered collections and integer operations"
  ],
  "negative_controls": [
    "dispatch-before-authorize",
    "blind-replay",
    "response-binding",
    "passing-selection"
  ],
  "report": {
    "schema_version": "1.0.0",
    "system": "BlindReplayMutant",
    "result": "refuted",
    "complete": false,
    "explored_states": 2,
    "explored_transitions": 1,
    "bounds": {
      "max_states": 10000,
      "max_depth": 100
    },
    "properties": [
      {
        "property": "NoBlindReplay",
        "result": "refuted",
        "reason": "property `NoBlindReplay` is false in reachable state 0",
        "witness": {
          "steps": [
            {
              "index": 0,
              "action": null,
              "state": {
                "dispatch_count": 1,
                "phase": "indeterminate"
              },
              "available_capabilities": [],
              "enabled_actions": [
                "dispatch"
              ]
            }
          ]
        }
      }
    ]
  }
}
