{
  "schema_version": "1.0.0",
  "result_id": "nmlt-benchmark-result-v1:sha256:40af22e2b69999d1162e1e2d69c733bb234bfae94a6b21799f54333a1b79721d",
  "case_id": "response-binding",
  "source": {
    "path": "benchmarks/seeded-defects/provider-attempt/response-binding.nmlt",
    "source_id": "nmlt-source-v1:sha256:3f491ca3c289a1d5eff7d11519fb4509e60345aa8eb60819baa1ad442460462e"
  },
  "engine": {
    "name": "nmlt-explicit-state",
    "version": "0.0.1",
    "source_set_id": "nmlt-engine-source-set-v1:sha256:725f2eb4cb362a908699ff736ac32fb119bf0e4f3fa11840aae08c3bf75a35d0",
    "executable_sha256": "6a6976a5c3ba67d0520594f36344748e8663db8497c57f93d8209a98e095b2b4",
    "toolchain": "rustc 1.94.0 (4a4ef493e 2026-03-02)",
    "target": "x86_64-unknown-linux-gnu",
    "algorithm": "deterministic-bfs-v1",
    "report_schema": "model-check-report/1.0.0"
  },
  "configuration": {
    "max_states": 10000,
    "max_depth": 100,
    "action_order": "lexicographic-action-then-state",
    "terminal_behavior": "identity-stutter"
  },
  "assumptions": [
    "The executable provider fragment and i64 arithmetic match the frozen source intent.",
    "A model_checked result requires exhaustion of the reachable frontier within both bounds."
  ],
  "trusted_components": [
    "nmlt-core lossless lexer",
    "nmlt-engine parser, contextual elaborator, type checker, evaluator, and BFS explorer",
    "Rust standard library ordered collections and integer operations"
  ],
  "negative_controls": [
    "dispatch-before-authorize",
    "blind-replay",
    "response-binding",
    "passing-selection"
  ],
  "report": {
    "schema_version": "1.0.0",
    "system": "ResponseBindingMutant",
    "result": "refuted",
    "complete": true,
    "explored_states": 2,
    "explored_transitions": 2,
    "bounds": {
      "max_states": 10000,
      "max_depth": 100
    },
    "properties": [
      {
        "property": "EvaluationRequiresIntactResponse",
        "result": "refuted",
        "reason": "property `EvaluationRequiresIntactResponse` is false in reachable state 1",
        "witness": {
          "steps": [
            {
              "index": 0,
              "action": null,
              "state": {
                "phase": "dispatched",
                "response_intact": false
              },
              "available_capabilities": [],
              "enabled_actions": [
                "evaluate"
              ]
            },
            {
              "index": 1,
              "action": "evaluate",
              "state": {
                "phase": "evaluated",
                "response_intact": false
              },
              "available_capabilities": [],
              "enabled_actions": [
                "evaluate"
              ]
            }
          ]
        }
      }
    ]
  }
}
