{
  "schema_version": "1.0.0",
  "result_id": "nmlt-benchmark-result-v1:sha256:cec29a093e57249fff4175cdc7b14dbe500a4ef4834f6458c9e023a3591cd8ad",
  "case_id": "passing-selection",
  "source": {
    "path": "benchmarks/seeded-defects/provider-attempt/passing-selection.nmlt",
    "source_id": "nmlt-source-v1:sha256:ae395e8f3941be5647d30015e7689332e3bcf00948329e3d8b88960b65e71f37"
  },
  "engine": {
    "name": "nmlt-explicit-state",
    "version": "0.0.1",
    "source_set_id": "nmlt-engine-source-set-v1:sha256:d4a05cc6e5f37915f2fd5f5171d1d341300441ef5471a923c78ff83771dcf013",
    "executable_sha256": "6a6976a5c3ba67d0520594f36344748e8663db8497c57f93d8209a98e095b2b4",
    "toolchain": "rustc 1.94.0 (4a4ef493e 2026-03-02)",
    "target": "x86_64-unknown-linux-gnu",
    "algorithm": "deterministic-bfs-v1",
    "report_schema": "model-check-report/1.0.0"
  },
  "configuration": {
    "max_states": 10000,
    "max_depth": 100,
    "action_order": "lexicographic-action-then-state",
    "terminal_behavior": "identity-stutter"
  },
  "assumptions": [
    "The executable provider fragment and i64 arithmetic match the frozen source intent.",
    "A model_checked result requires exhaustion of the reachable frontier within both bounds."
  ],
  "trusted_components": [
    "nmlt-core lossless lexer",
    "nmlt-engine parser, contextual elaborator, type checker, evaluator, and BFS explorer",
    "Rust standard library ordered collections and integer operations"
  ],
  "negative_controls": [
    "dispatch-before-authorize",
    "blind-replay",
    "response-binding",
    "passing-selection"
  ],
  "report": {
    "schema_version": "1.0.0",
    "system": "PassingSelectionMutant",
    "result": "refuted",
    "complete": true,
    "explored_states": 2,
    "explored_transitions": 2,
    "bounds": {
      "max_states": 10000,
      "max_depth": 100
    },
    "properties": [
      {
        "property": "SelectionRequiresPass",
        "result": "refuted",
        "reason": "property `SelectionRequiresPass` is false in reachable state 1",
        "witness": {
          "steps": [
            {
              "index": 0,
              "action": null,
              "state": {
                "passed": false,
                "phase": "evaluated"
              },
              "available_capabilities": [],
              "enabled_actions": [
                "select"
              ]
            },
            {
              "index": 1,
              "action": "select",
              "state": {
                "passed": false,
                "phase": "selected"
              },
              "available_capabilities": [],
              "enabled_actions": [
                "select"
              ]
            }
          ]
        }
      }
    ]
  }
}
